{
  "components": {
    "context": {
      "paths": ["scripts/arena_context.py", ".arena/contexts", ".arena/contexts.lock.json"],
      "required": true
    },
    "mcp": {
      "paths": [
        "loopctl/mcp_contract.ts",
        "loopctl/mcp_execution.ts",
        "loopctl/mcp_core.ts",
        "loopctl/mcp_tools.ts",
        "loopctl/mcp_runtime.ts",
        "loopctl/mcp_tools.py",
        "loopctl/mcp_runtime.py",
        "loopctl/mcp_server.py",
        ".arena/mcp-policy.json"
      ],
      "required": true
    },
    "proof": {
      "paths": [
        "loopctl/selftest.sh",
        "loopctl/surface.lock",
        "loopctl/mcp_core.test.ts",
        "data/context-capsules/driver-parity.json",
        "scripts/gates/check_mcp_policy.ts",
        "scripts/gates/check_mcp_policy.py",
        "tests/test_ctg_mcp_carrier.sh"
      ],
      "required": true
    },
    "runtime": {
      "paths": [
        "loopctl/loopctl.sh",
        "loopctl/contract.json",
        "loopctl/package.json",
        "loopctl/tsconfig.json",
        "scripts/arena_context.py"
      ],
      "required": true
    }
  },
  "conflicts": [],
  "external_policy": {"exposed": true, "mutation": "disposable-worktree", "network": "optional", "secrets": "broker-only"},
  "id": "loop-runtime",
  "interface_version": "1.3.0",
  "loops": [
    {"class": "core", "external_policy": "allowlisted", "id": "loopctl", "interface_version": "2.8.0", "public_port": "sh loopctl/loopctl.sh"},
    {"class": "core", "external_policy": "control-only", "id": "context-capsule", "interface_version": "1.0.0", "public_port": "python3 scripts/arena_context.py"},
    {"class": "core", "external_policy": "control-only", "id": "mcp-policy", "interface_version": "1.1.0", "public_port": "bun scripts/gates/check_mcp_policy.ts"}
  ],
  "proof": {
    "control": ["sh", "tests/test_ctg_mcp_carrier.sh"],
    "mutation": ["bun", "test", "loopctl/mcp_core.test.ts"],
    "selftest": ["bun", "loopctl/mcp_runtime.ts", "--selftest"],
    "verify": ["bun", "scripts/gates/check_mcp_policy.ts"]
  },
  "provides": ["arena.loopctl/v1", "arena.stateless-mcp/v1", "arena.context-carrier/v1"],
  "requires": ["arena.passive-context/v1"],
  "roots": ["loopctl", "scripts/arena_context.py"],
  "runtime": {"profiles": ["bettor-arena-runtime-local"], "tools": ["bun", "claude", "codex", "git", "python3", "sh"]},
  "schema": "bettor-arena/module/v1",
  "skills": {"optional": [], "repo_owned": [], "required": ["shared-skills-infra"]},
  "summary": "Stable loopctl surface, immutable Context Capsules, fixed Claude/Codex canaries, and a Bun/TypeScript default-deny stateless MCP runtime with selected module closures and disposable execution."
}
