{
  "components": {
    "contracts": {
      "paths": [
        "loop_wiki/loopx-knowledge-foldback/contracts"
      ],
      "required": true
    },
    "proof": {
      "paths": [
        "loop_wiki/loopx-knowledge-foldback/tests"
      ],
      "required": true
    },
    "runtime": {
      "paths": [
        "loop_wiki/loopx-knowledge-foldback/scripts"
      ],
      "required": true
    }
  },
  "conflicts": [],
  "external_policy": {
    "exposed": false,
    "mutation": "none",
    "network": "none",
    "secrets": "none"
  },
  "id": "loopx-knowledge-foldback",
  "interface_version": "1.0.0",
  "loops": [
    {
      "class": "core",
      "external_policy": "control-only",
      "id": "loopx-knowledge-foldback",
      "interface_version": "1.0.0",
      "public_port": "python3 loop_wiki/loopx-knowledge-foldback/scripts/foldback.py"
    }
  ],
  "proof": {
    "control": [
      "python3",
      "loop_wiki/loopx-knowledge-foldback/scripts/control_foldback.py"
    ],
    "mutation": [
      "python3",
      "loop_wiki/loopx-knowledge-foldback/scripts/foldback.py",
      "selftest"
    ],
    "selftest": [
      "python3",
      "loop_wiki/loopx-knowledge-foldback/scripts/foldback.py",
      "selftest"
    ],
    "verify": [
      "sh",
      "loop_wiki/loopx-knowledge-foldback/tests/run-all.sh"
    ]
  },
  "provides": [
    "loopx.knowledge-foldback/v1",
    "loopx.knowledge-revision-history/v1"
  ],
  "requires": [
    "arena.proof-kernel/v1",
    "loopx.code-truth-graph/v2",
    "loopx.contracts/v1",
    "loopx.ledger/v1"
  ],
  "roots": [
    "loop_wiki/loopx-knowledge-foldback"
  ],
  "runtime": {
    "profiles": [],
    "tools": [
      "python3",
      "sh"
    ]
  },
  "schema": "bettor-arena/module/v1",
  "skills": {
    "optional": [],
    "repo_owned": [],
    "required": []
  },
  "summary": "Compiles a verified code change into evidence-bound candidate knowledge patches with content-pinned anchors, keeping STATIC, TEST and RUNTIME evidence distinct, preserving conflicts and supersessions in an append-only history, and writing nothing before Human Admit."
}
